ontology,ontology_code,ontology_comment,secondary_ontology,secondary_ontology_code,secondary_ontology_comment,snomed_vartype,ES LAFE,IL HMC,dataset,name,description,vartype,ETL_type,details,example,JSON_values,Doubts_Ana
snomed ct,422549004,,,,,,1,1,Baseline_Clinical_Table.xlsx,Patient ID,Patient identified number,STR,STR,Alphanumeric with dash format,,,
snomed ct,184099003 : 258707000,,,,,,1,1,Baseline_Clinical_Table.xlsx,YOB,Year of birth,INT,INT,,,,
snomed ct,734000001,,,,,,1,1,Baseline_Clinical_Table.xlsx,Sex,Sex,STR,category?,{M} Male\\{F} Female,,"[{""value"": ""M"", ""explanation"": ""Male"", ""snomed_ct"": ""248153007""}, {""value"": ""F"", ""explanation"": ""Female,"" ""snomed_ct"": ""248152002""}]",
snomed ct,364699009 : 66839005,,,,,,0,1,Baseline_Clinical_Table.xlsx,Porigin,Paternal Ethnic origin,STR,category?,,,"[{'value': 'ASH', 'explanation': 'Ashkenazi Jewish', 'orphanet': '81706006'}, {'value': 'NA', 'explanation': 'North African Jewish', 'orphanet': '397731000 : 160543007 = 275586009'}, {'value': 'O', 'explanation': 'Oriental Jewish', 'orphanet': '51827000'}, {'value': 'Y', 'explanation': 'Yemenite Jewish', 'orphanet': '397731000 : 160543007 = 315590007'}, {'value': 'Et', 'explanation': 'Ethiopian Jewish', 'orphanet': '397731000 : 160543007 = 315424008'}, {'value': 'S', 'explanation': 'Syrian Jewish', 'orphanet': '397731000 : 160543007 = 59487007'}, {'value': 'B', 'explanation': 'Buchara Jewish', 'orphanet': '397731000 : 160543007 = 223579001'}, {'value': 'BU', 'explanation': 'Bulgaria Jewish', 'orphanet': '397731000 : 160543007 = 29343004'}, {'value': 'I', 'explanation': 'Indian Jewish', 'orphanet': '397731000 : 160543007 = 64483007'}, {'value': 'IS', 'explanation': 'Isreali Jewish', 'orphanet': '397731000 : 160543007 = 315449007'}, {'value': 'M', 'explanation': 'Mix Jewish', 'orphanet': '397731000 : 160543007 = 160551005'}, {'value': 'MR', 'explanation': 'Mixed religion', 'orphanet': '160551005'}, {'value': 'G', 'explanation': 'Georgian Jewish', 'orphanet': '397731000 : 160543007 = 32045009'}, {'value': 'Gr', 'explanation': 'Greece Jewish', 'orphanet': '397731000 : 160543007 = 1451003'}, {'value': 'T', 'explanation': 'Turkish Jewish', 'orphanet': '397731000 : 160543007 = 44460002'}, {'value': 'Eg', 'explanation': 'Egyptian Jewish', 'orphanet': '397731000 : 160543007 = 1919006'}, {'value': 'U', 'explanation': 'Unknown', 'orphanet': '261665006'}, {'value': 'AM', 'explanation': 'Arab Muslim', 'orphanet': '397731000 : 90027003 = 309884000'}, {'value': 'B', 'explanation': 'Bedouin', 'orphanet': '154182006'}, {'value': 'AC', 'explanation': 'Arab Christian', 'orphanet': '397731000 : 90027003 = 276116000'}]",
snomed ct,364699009 : 72705000,,,,,,0,1,Baseline_Clinical_Table.xlsx,Morigin,Maternal Ethnic origin,STR,category?,,,"[{'value': 'ASH', 'explanation': 'Ashkenazi Jewish', 'orphanet': '81706006'}, {'value': 'NA', 'explanation': 'North African Jewish', 'orphanet': '397731000 : 160543007 = 275586009'}, {'value': 'O', 'explanation': 'Oriental Jewish', 'orphanet': '51827000'}, {'value': 'Y', 'explanation': 'Yemenite Jewish', 'orphanet': '397731000 : 160543007 = 315590007'}, {'value': 'Et', 'explanation': 'Ethiopian Jewish', 'orphanet': '397731000 : 160543007 = 315424008'}, {'value': 'S', 'explanation': 'Syrian Jewish', 'orphanet': '397731000 : 160543007 = 59487007'}, {'value': 'B', 'explanation': 'Buchara Jewish', 'orphanet': '397731000 : 160543007 = 223579001'}, {'value': 'BU', 'explanation': 'Bulgaria Jewish', 'orphanet': '397731000 : 160543007 = 29343004'}, {'value': 'I', 'explanation': 'Indian Jewish', 'orphanet': '397731000 : 160543007 = 64483007'}, {'value': 'IS', 'explanation': 'Isreali Jewish', 'orphanet': '397731000 : 160543007 = 315449007'}, {'value': 'M', 'explanation': 'Mix Jewish', 'orphanet': '397731000 : 160543007 = 160551005'}, {'value': 'MR', 'explanation': 'Mixed religion', 'orphanet': '160551005'}, {'value': 'G', 'explanation': 'Georgian Jewish', 'orphanet': '397731000 : 160543007 = 32045009'}, {'value': 'Gr', 'explanation': 'Greece Jewish', 'orphanet': '397731000 : 160543007 = 1451003'}, {'value': 'T', 'explanation': 'Turkish Jewish', 'orphanet': '397731000 : 160543007 = 44460002'}, {'value': 'Eg', 'explanation': 'Egyptian Jewish', 'orphanet': '397731000 : 160543007 = 1919006'}, {'value': 'U', 'explanation': 'Unknown', 'orphanet': '261665006'}, {'value': 'AM', 'explanation': 'Arab Muslim', 'orphanet': '397731000 : 90027003 = 309884000'}, {'value': 'B', 'explanation': 'Bedouin', 'orphanet': '154182006'}, {'value': 'AC', 'explanation': 'Arab Christian', 'orphanet': '397731000 : 90027003 = 276116000'}]",
snomed ct,782964007,,,,,,1,1,Baseline_Clinical_Table.xlsx,Dx,Clinical diagnosis,STR,STR,"LAFE will provide OrphaNet codes, HMC will provide abbreviations that need to be mapped to Orphanet according to the JSON field mapping.",,"[{'value': 'ABL', 'explanation': 'Abetalipoproteinemia', 'orphanet': 'ORPHA:14'}, {'value': 'ACHM', 'explanation': 'Achromatopsia', 'orphanet': 'ORPHA:49382'}, {'value': 'ALMS', 'explanation': 'Alström syndrome', 'orphanet': 'ORPHA:64'}, {'value': 'BBS', 'explanation': 'Bardet-Biedl syndrome', 'orphanet': 'ORPHA:110'}, {'value': 'BVMD', 'explanation': 'Best vitelliform macular dystrophy / bestrophinopathy', 'orphanet': 'ORPHA:1243'}, {'value': 'BCD', 'explanation': 'Bietti crystalline retinal dystrophy', 'orphanet': 'ORPHA:41751'}, {'value': 'BCM', 'explanation': 'Blue-cone monochromacy', 'orphanet': 'ORPHA:16'}, {'value': 'CACD', 'explanation': 'Central areolar choroidal dystrophy', 'orphanet': 'ORPHA:75377'}, {""value"": ""CHM"", ""explanation"": ""Choroideremia"", ""orphanet"": ""ORPHA:180""}, {""value"": ""CD"", ""explanation"": ""Cone dystrophy"", ""orphanet"": ""ORPHA:1871""}, {""value"": ""CDSRR"", ""explanation"": ""Cone dystrophy with supernormal rod response"", ""orphanet"": ""ORPHA:209932""}, {""value"": ""CRD"", ""explanation"": ""Cone-rod dystrophy"", ""orphanet"": ""ORPHA:1872""}, {""value"": ""CRDHL"", ""explanation"": ""Cone-rod dystrophy and hearing loss"", ""orphanet"": """"}, {""value"": ""CSNB"", ""explanation"": ""Congenital stationary night blindness"", ""orphanet"": ""ORPHA:75382""}, {""value"": ""DHRD"", ""explanation"": ""Doyne honeycomb retinal degeneration"", ""orphanet"": ""ORPHA:75376""}, {""value"": ""ESCS"", ""explanation"": ""Enhanced S-cone syndrome"", ""orphanet"": ""ORPHA:53540""}, {""value"": ""FEVR"", ""explanation"": ""Familial exudative vitreoretinopathy"", ""orphanet"": ""ORPHA:891""}, {""value"": ""FA"", ""explanation"": ""Fundus albipunctatus"", ""orphanet"": ""ORPHA:227796""}, {""value"": ""GFS"", ""explanation"": ""Goldmann-Favre syndrome"", ""orphanet"": ""ORPHA:53540""}, {""value"": ""HARP"", ""explanation"": ""Hypoprebetalipoproteinemia, acanthocytosis, retinitis pigmentosa, and pallidal degeneration"", ""orphanet"": ""ORPHA:157855""}, {""value"": ""JBTS"", ""explanation"": ""Joubert syndrome"", ""orphanet"": ""ORPHA:475""}, {""value"": ""KSS"", ""explanation"": ""Kearns-Sayre syndrome"", ""orphanet"": ""ORPHA:480""}, {""value"": ""KNO"", ""explanation"": ""Knobloch syndrome"", ""orphanet"": ""ORPHA:1571""}, {""value"": ""LCA"", ""explanation"": ""Leber congenital amaurosis"", ""orphanet"": ""ORPHA:65""}, {""value"": ""MD"", ""explanation"": ""Maculopathy"", ""orphanet"": ""ORPHA:519302""}, {""value"": ""ND"", ""explanation"": ""Norrie disease"", ""orphanet"": ""ORPHA:649""}, {""value"": ""RP"", ""explanation"": ""Retinitis pigmentosa"", ""orphanet"": ""ORPHA:791""}, {""value"": ""RPA"", ""explanation"": ""Retinitis punctata albescens"", ""orphanet"": ""ORPHA:52427""}, {""value"": ""RS"", ""explanation"": ""Retinoschisis"", ""orphanet"": ""ORPHA:792""}, {""value"": ""SLSN"", ""explanation"": ""Senior-Loken syndrome"", ""orphanet"": ""ORPHA:3156""}, {""value"": ""SFD"", ""explanation"": ""Sorsby fundus dystrophy"", ""orphanet"": ""ORPHA:59181""}, {""value"": ""STGD"", ""explanation"": ""Stargardt disease"", ""orphanet"": ""ORPHA:827""}, {""value"": ""USH"", ""explanation"": ""Usher syndrome"", ""orphanet"": ""ORPHA:886""}]",
snomed ct,445518008,,,,,,1,1,Baseline_Clinical_Table.xlsx,Onset,Age of disease Onset group,INT,INT,"LAFE provides age in years, while HMC provides age as a categoric variable with several values.",15,,What does this field means?
snomed ct,15188001,,,,,,1,1,Baseline_Clinical_Table.xlsx,HR,Hearing disability,STR,bool,{yes}\\{no},,"[{""value"": ""no"", ""explanation"": ""No"", ""snomed_ct"": ""373067005""}, {""value"": ""yes"", ""explanation"": ""Yes"", ""snomed_ct"": ""373066001""}, {""value"": ""NO"", ""explanation"": ""No"", ""snomed_ct"": ""373067005""}, {""value"": ""YES"", ""explanation"": ""Yes"", ""snomed_ct"": ""373066001""}]",
,,to be defined after selection of comorbidities,,,,,1,1,Baseline_Clinical_Table.xlsx,Comorb,Other comorbidities,Boolean,bool,"Set of variables for different comorbidities, with indication {yes}\{no} for each one.\\Currently represented by one variable, but will be preplaced by multiple when the comorbidities set will be defined.",,,
snomed ct,422549004,,,,,,1,1,Genetic_Table.xlsx,Patient ID,Patient identified number,STR,STR,,,,
snomed ct,272398008,,,,,,1,1,Genetic_Table.xlsx,Inheritance pattern,Inheritance pattern,STR,category?," (AR, AD, XL)",AR,"[{""value"": ""AR"", ""explanation"": ""Autosomal recessive inheritance"", ""snomed_ct"": ""258211005""}, {""value"": ""AD"", ""explanation"": ""Autosomal dominant inheritance"", ""snomed_ct"": ""263681008""}, {""value"": ""XL"", ""explanation"": ""X-linked inheritance"", ""snomed_ct"": ""263934009""}]",
snomed ct,55446002,,,,,,1,1,Genetic_Table.xlsx,Gene,Causing gene,STR,STR,Only NLM Gene https://www.ncbi.nlm.nih.gov/gene/ is used.,ABCA4,,Is the inheritance pattern referring to the gene or to the variant?
snomed ct,106221001 : 255216001,,,,,,1,1,Genetic_Table.xlsx,Mutation 1,Causing mutation 1,STR,STR,"Only NLM ClinVar database https://www.ncbi.nlm.nih.gov/clinvar/ is used.
For protein nomenclature, LAFE uses a three-letter code, while HMC uses a single letter.",c.5882G>A;p.(Gly1961Glu),,
snomed ct,106221001 : 81170007,,,,,,1,1,Genetic_Table.xlsx,Mutation 2,Causing mutation 2,STR,STR,"Only NLM ClinVar database https://www.ncbi.nlm.nih.gov/clinvar/ is used.\\""NA"" will be used if no second causing was found.","c.2276G>T
 p.(Cys759Phe)",,
snomed ct,422549004,,,,,,1,1,Dynamic_Clinical_Table.xlsx,Patient ID,Patient identified number,STR,STR,,,,
snomed ct,397669002 : 305674005,,,,,,1,1,Dynamic_Clinical_Table.xlsx,Age,Age of examination,INT,INT,,16,,
snomed ct,419775003 : 24028007,,,,,,1,1,Dynamic_Clinical_Table.xlsx,REVA,Best Corrected Visual acuity right eye,INT,float?,,"0,05",,
snomed ct,419775003 : 7771000,,,,,,1,1,Dynamic_Clinical_Table.xlsx,LEVA,Best Corrected Visual acuity left eye,INT,float?,,"0,05",,
snomed ct,21324001 : 24028007,,,,,,1,1,Dynamic_Clinical_Table.xlsx,REref,Right eye refraction,STR,STR,Defined as integer with obligatory +/- sign,"{-3}, {+3.5}, {NA}",,
snomed ct,21324001 : 7771000,,,,,,1,1,Dynamic_Clinical_Table.xlsx,LEref,Left eye refraction,STR,STR,Defined as integer with obligatory +/- sign,,,
snomed ct,252783009 : 24028007,,,,,,1,1,Dynamic_Clinical_Table.xlsx,RodRE,Rod b-wave amplidute right eye,INT,INT,"""0"" values are possible that means the test was done and no response was measured, therefore the value is zero.\\If the test was not performed, there will be “NA” (not available).",,,
snomed ct,252783009 : 7771000,,,,,,1,1,Dynamic_Clinical_Table.xlsx,RodLE,Rod b-wave amplidute left eye,INT,INT,"""0"" values are possible that means the test was done and no response was measured, therefore the value is zero.\\If the test was not performed, there will be “NA” (not available).",,,
snomed ct,252780007 : 420512001 : 24028007,,,,,,1,1,Dynamic_Clinical_Table.xlsx,MixREA,Mixed cone-rod a-waxe right eye,INT,INT,"""0"" values are possible that means the test was done and no response was measured, therefore the value is zero.\\If the test was not performed, there will be “NA” (not available).",,,
snomed ct,252780007 : 420512001 : 7771000,,,,,,1,1,Dynamic_Clinical_Table.xlsx,MixLEA,Mixed cone-rod a-waxe left eye,INT,INT,"""0"" values are possible that means the test was done and no response was measured, therefore the value is zero.\\If the test was not performed, there will be “NA” (not available).",,,
snomed ct,252780007 : 257983009 : 24028007,,,,,,1,1,Dynamic_Clinical_Table.xlsx,MixREB,Mixed cone-rod b-waxe right eye,INT,INT,"""0"" values are possible that means the test was done and no response was measured, therefore the value is zero.\\If the test was not performed, there will be “NA” (not available).",,,
snomed ct,252780007 : 257983009 : 7771000,,,,,,1,1,Dynamic_Clinical_Table.xlsx,MixLEB,Mixed cone-rod b-waxe left eye,INT,INT,"""0"" values are possible that means the test was done and no response was measured, therefore the value is zero.\\If the test was not performed, there will be “NA” (not available).",,,
snomed ct,252782004 : 419862005 : 24028007,,,,,,1,1,Dynamic_Clinical_Table.xlsx,ConeREamp,Cone 30Hx amplitude right eye,INT,INT,"""0"" values are possible that means the test was done and no response was measured, therefore the value is zero.\\If the test was not performed, there will be “NA” (not available).",,,
snomed ct,252782004 : 419862005 : 7771000,,,,,,1,1,Dynamic_Clinical_Table.xlsx,ConeLEamp,Cone 30Hx amplitude left eye,INT,INT,"""0"" values are possible that means the test was done and no response was measured, therefore the value is zero.\\If the test was not performed, there will be “NA” (not available).",,,
snomed ct,252782004 : 410669006 : 24028007,,,,,,1,1,Dynamic_Clinical_Table.xlsx,ConeREimp,Cone implicit time right eye,INT,INT,"""0"" values are possible that means the test was done and no response was measured, therefore the value is zero.\\If the test was not performed, there will be “NA” (not available).",,,
snomed ct,252782004 : 410669006 : 7771000,,,,,,1,1,Dynamic_Clinical_Table.xlsx,ConeLEimp,Cone implicit time left eye,INT,INT,"""0"" values are possible that means the test was done and no response was measured, therefore the value is zero.\\If the test was not performed, there will be “NA” (not available).",,,
snomed ct,33048000 : 24028007,,,,,,1,1,Dynamic_Clinical_Table.xlsx,PVFRE,Periferal visual field impairment right eye,STR,bool?,"{yes}\\{no}
We are considering whether it is possible to work directly with the image, even though it is a PDF.
If the information will be available, the residual degrees for visual field will be provided (like 12º or 10º), example: eyes had a constricted visual field < 10. 
The format of numerical information provision is not yed defined: it could be either INT (12) or STR (12º).
This concerns all visual fields impairment variables.",YES or 10º,"[{""value"": ""no"", ""explanation"": ""No"", ""snomed_ct"": ""373067005""}, {""value"": ""yes"", ""explanation"": ""Yes"", ""snomed_ct"": ""373066001""}]",
snomed ct,33048000 : 7771000,,,,,,1,1,Dynamic_Clinical_Table.xlsx,PVFLE,Periferal visual field impairment left eye,STR,bool,{yes}\\{no},,"[{""value"": ""no"", ""explanation"": ""No"", ""snomed_ct"": ""373067005""}, {""value"": ""yes"", ""explanation"": ""Yes"", ""snomed_ct"": ""373066001""}]",
snomed ct,698606000 : 24028007,"The snomed code 698606000 is for ""Localized visual field defect"", not central",,,,,1,1,Dynamic_Clinical_Table.xlsx,CVFRE,Central visual field impairment right eye,STR,bool,{yes}\\{no},,"[{""value"": ""no"", ""explanation"": ""No"", ""snomed_ct"": ""373067005""}, {""value"": ""yes"", ""explanation"": ""Yes"", ""snomed_ct"": ""373066001""}]",
snomed ct,698606000 : 7771000,"The snomed code 698606000 is for ""Localized visual field defect"", not central",,,,,1,1,Dynamic_Clinical_Table.xlsx,CVFLE,Central visual field impairment left eye,STR,bool,{yes}\\{no},,"[{""value"": ""no"", ""explanation"": ""No"", ""snomed_ct"": ""373067005""}, {""value"": ""yes"", ""explanation"": ""Yes"", ""snomed_ct"": ""373066001""}]",
,,,,,,,1,1,Dynamic_Clinical_Table.xlsx,NO_NAME_YET,"Residual central field- right eye, size III target",INT,float?,"Degrees from fixation. This information can be obtained from the pdf with results of visual field examination, but decision on its inclusion will be bade later.",,,
,,,,,,,1,1,Dynamic_Clinical_Table.xlsx,NO_NAME_YET,"Residual central field- left eye, size III target",INT,float?,"Degrees from fixation. This information can be obtained from the pdf with results of visual field examination, but decision on its inclusion will be bade later.",,,
,,,,,,,1,1,Dynamic_Clinical_Table.xlsx,NO_NAME_YET,"Residual central field- right eye, size V target",INT,float?,"Degrees from fixation. This information can be obtained from the pdf with results of visual field examination, but decision on its inclusion will be bade later.",,,
,,,,,,,1,1,Dynamic_Clinical_Table.xlsx,NO_NAME_YET,"Residual central field- left eye, size V target",INT,float?,"Degrees from fixation. This information can be obtained from the pdf with results of visual field examination, but decision on its inclusion will be bade later.",,,
snomed ct,422549004,,,,,,1,1,Imaging data - To be defined,Patient ID,Patient identified number,STR,STR,,,,
snomed ct,20067007 : 250429001,,,,,,1,1,Imaging data - To be defined,Fundus,Fundus description,Image file,Image file,"It is of great importance to develop the ability to perform automated image analysis of the wide field fundus photos, both colour and Fundus autofluorescence, and not to use free text descriptions that is not machine-readable.",,,
snomed ct,20067007 : 24028007,"There is also CDISC code C166089, and CDISC has EXLAT laterality concept (LEFT C25229 and RIGHT C25228), but the post-coordination is not clear",,,,,1,1,Imaging data - To be defined,WFRE,Wide-field color right eye,Image file,Image file,,,,
snomed ct,20067007 : 7771000,,,,,,1,1,Imaging data - To be defined,WFLE,Wide-field color left eye,Image file,Image file,,,,
snomed ct,252822006 : 24028007,,,,,,1,1,Imaging data - To be defined,WFFAFRE,Wide-field fundus autofluorescence right eye,Image file,Image file,,,,
snomed ct,252822006 : 7771000,,,,,,1,1,Imaging data - To be defined,WFFAFLE,Wide-field fundus autofluorescence left eye,Image file,Image file,,,,
snomed ct,37231002 : 24028007,,,,,,1,1,Imaging data - To be defined,CMERE,Cystoid Macular edema presence right eye,STR,bool?,{yes}\\{no}. The centers consider to provide image files from which this parameter will be extracted but the final decision will be made later.,,"[{""value"": ""no"", ""explanation"": ""No"", ""snomed_ct"": ""373067005""}, {""value"": ""yes"", ""explanation"": ""Yes"", ""snomed_ct"": ""373066001""}]",
snomed ct,37231002 : 7771000,,,,,,1,1,Imaging data - To be defined,CMELE,Cystoid Macular edema presence left eye,STR,bool?,{yes}\\{no}. The centers consider to provide image files from which this parameter will be extracted but the final decision will be made later.,,"[{""value"": ""no"", ""explanation"": ""No"", ""snomed_ct"": ""373067005""}, {""value"": ""yes"", ""explanation"": ""Yes"", ""snomed_ct"": ""373066001""}]",
snomed ct,416369006 : 24028007,,,,,,1,1,Imaging data - To be defined,OCTRE,Central optical coherence tomography scan right eye,Image file,Image file,,,,
snomed ct,416369006 : 7771000,,,,,,1,1,Imaging data - To be defined,OCTLE,Central optical coherence tomography scan left eye,Image file,Image file,,,,
snomed ct,310418000,,,,,,0,1,Imaging data - To be defined,BC,Blindness Certificate,STR,bool,{yes}\\{no},,"[{""value"": ""no"", ""explanation"": ""No"", ""snomed_ct"": ""373067005""}, {""value"": ""yes"", ""explanation"": ""Yes"", ""snomed_ct"": ""373066001""}]",